{
  "unitOfWork": "spec",
  "specsDir": "specs",
  "workDir": "specs/current",
  "hooks": {
    "sessionStartNudge": {
      "enabled": true,
      "threshold": 20,
      "message": "You have ${count} unprocessed ${unitOfWork}s. Consider running /zoto-spec-create to organize."
    }
  },
  "spec": {
    "maxSubtasks": 99,
    "parallelLimit": 4,
    "preferredModel": "composer-2",
    "adversarialVerification": true
  },
  "extensions": {
    "memory": {
      "enabled": false,
      "plugin": null
    }
  }
}
